Parsed test spec with 4 sessions
NOTICE:  identifier "isolation/ducklake/deletion_inlining/test_deletion_inlining_concurrent_retry" will be truncated to "isolation/ducklake/deletion_inlining/test_deletion_inlining_con"
NOTICE:  identifier "isolation/ducklake/deletion_inlining/test_deletion_inlining_concurrent_retry" will be truncated to "isolation/ducklake/deletion_inlining/test_deletion_inlining_con"
r0: NOTICE:  identifier "isolation/ducklake/deletion_inlining/test_deletion_inlining_con/r0" will be truncated to "isolation/ducklake/deletion_inlining/test_deletion_inlining_con"
NOTICE:  identifier "isolation/ducklake/deletion_inlining/test_deletion_inlining_concurrent_retry" will be truncated to "isolation/ducklake/deletion_inlining/test_deletion_inlining_con"
r1: NOTICE:  identifier "isolation/ducklake/deletion_inlining/test_deletion_inlining_con/r1" will be truncated to "isolation/ducklake/deletion_inlining/test_deletion_inlining_con"
NOTICE:  identifier "isolation/ducklake/deletion_inlining/test_deletion_inlining_concurrent_retry" will be truncated to "isolation/ducklake/deletion_inlining/test_deletion_inlining_con"
r2: NOTICE:  identifier "isolation/ducklake/deletion_inlining/test_deletion_inlining_con/r2" will be truncated to "isolation/ducklake/deletion_inlining/test_deletion_inlining_con"
NOTICE:  identifier "isolation/ducklake/deletion_inlining/test_deletion_inlining_concurrent_retry" will be truncated to "isolation/ducklake/deletion_inlining/test_deletion_inlining_con"
checker: NOTICE:  identifier "isolation/ducklake/deletion_inlining/test_deletion_inlining_con/checker" will be truncated to "isolation/ducklake/deletion_inlining/test_deletion_inlining_con"

starting permutation: r0_begin r0_pin r1_begin r1_pin r2_begin r2_pin r0_delete r1_delete r2_delete r0_commit r1_commit r2_commit check_rows
step r0_begin: BEGIN;
step r0_pin: SELECT count(*) AS pinned_rows FROM upstream_iso_delete_retry_0;
pinned_rows
-----------
         50
(1 row)

step r1_begin: BEGIN;
step r1_pin: SELECT count(*) AS pinned_rows FROM upstream_iso_delete_retry_1;
pinned_rows
-----------
         50
(1 row)

step r2_begin: BEGIN;
step r2_pin: SELECT count(*) AS pinned_rows FROM upstream_iso_delete_retry_2;
pinned_rows
-----------
         50
(1 row)

step r0_delete: DELETE FROM upstream_iso_delete_retry_0 WHERE a < 5;
step r1_delete: DELETE FROM upstream_iso_delete_retry_1 WHERE a < 5;
step r2_delete: DELETE FROM upstream_iso_delete_retry_2 WHERE a < 5;
step r0_commit: COMMIT;
step r1_commit: COMMIT;
step r2_commit: COMMIT;
step check_rows: 
  SELECT table_id, rows, low_rows, value_sum
    FROM (VALUES
      (0,
       (SELECT count(*) FROM upstream_iso_delete_retry_0),
       (SELECT count(*) FROM upstream_iso_delete_retry_0 WHERE a < 5),
       (SELECT sum(a) FROM upstream_iso_delete_retry_0)),
      (1,
       (SELECT count(*) FROM upstream_iso_delete_retry_1),
       (SELECT count(*) FROM upstream_iso_delete_retry_1 WHERE a < 5),
       (SELECT sum(a) FROM upstream_iso_delete_retry_1)),
      (2,
       (SELECT count(*) FROM upstream_iso_delete_retry_2),
       (SELECT count(*) FROM upstream_iso_delete_retry_2 WHERE a < 5),
       (SELECT sum(a) FROM upstream_iso_delete_retry_2))
    ) AS results(table_id, rows, low_rows, value_sum)
   ORDER BY table_id;

table_id|rows|low_rows|value_sum
--------+----+--------+---------
       0|  45|       0|     1215
       1|  45|       0|     1215
       2|  45|       0|     1215
(3 rows)


starting permutation: r0_begin r0_pin r1_begin r1_pin r2_begin r2_pin r0_delete r1_delete r2_delete r2_commit r1_commit r0_commit check_rows
step r0_begin: BEGIN;
step r0_pin: SELECT count(*) AS pinned_rows FROM upstream_iso_delete_retry_0;
pinned_rows
-----------
         50
(1 row)

step r1_begin: BEGIN;
step r1_pin: SELECT count(*) AS pinned_rows FROM upstream_iso_delete_retry_1;
pinned_rows
-----------
         50
(1 row)

step r2_begin: BEGIN;
step r2_pin: SELECT count(*) AS pinned_rows FROM upstream_iso_delete_retry_2;
pinned_rows
-----------
         50
(1 row)

step r0_delete: DELETE FROM upstream_iso_delete_retry_0 WHERE a < 5;
step r1_delete: DELETE FROM upstream_iso_delete_retry_1 WHERE a < 5;
step r2_delete: DELETE FROM upstream_iso_delete_retry_2 WHERE a < 5;
step r2_commit: COMMIT;
step r1_commit: COMMIT;
step r0_commit: COMMIT;
step check_rows: 
  SELECT table_id, rows, low_rows, value_sum
    FROM (VALUES
      (0,
       (SELECT count(*) FROM upstream_iso_delete_retry_0),
       (SELECT count(*) FROM upstream_iso_delete_retry_0 WHERE a < 5),
       (SELECT sum(a) FROM upstream_iso_delete_retry_0)),
      (1,
       (SELECT count(*) FROM upstream_iso_delete_retry_1),
       (SELECT count(*) FROM upstream_iso_delete_retry_1 WHERE a < 5),
       (SELECT sum(a) FROM upstream_iso_delete_retry_1)),
      (2,
       (SELECT count(*) FROM upstream_iso_delete_retry_2),
       (SELECT count(*) FROM upstream_iso_delete_retry_2 WHERE a < 5),
       (SELECT sum(a) FROM upstream_iso_delete_retry_2))
    ) AS results(table_id, rows, low_rows, value_sum)
   ORDER BY table_id;

table_id|rows|low_rows|value_sum
--------+----+--------+---------
       0|  45|       0|     1215
       1|  45|       0|     1215
       2|  45|       0|     1215
(3 rows)

