-- Upstream: test/sql/data_inlining/partition_inlining.test
CALL ducklake.set_option('data_inlining_row_limit', 20);
CREATE TABLE upstream_inline_part_move (id integer, region text, amount double precision) USING ducklake;
CALL ducklake.set_partition('upstream_inline_part_move'::regclass, 'region');
INSERT INTO upstream_inline_part_move VALUES
 (1,'east',100), (2,'east',200), (3,'west',300), (4,'west',400);
UPDATE upstream_inline_part_move SET region = 'west' WHERE id = 1;
UPDATE upstream_inline_part_move SET region = 'central' WHERE id = 2;
SELECT * FROM upstream_inline_part_move ORDER BY id;
 id | region  | amount 
----+---------+--------
  1 | west    |    100
  2 | central |    200
  3 | west    |    300
  4 | west    |    400
(4 rows)

SELECT * FROM ducklake.flush_inlined_data('upstream_inline_part_move'::regclass);
 schema_name |        table_name         | rows_flushed 
-------------+---------------------------+--------------
 public      | upstream_inline_part_move |            6
(1 row)

SELECT * FROM upstream_inline_part_move ORDER BY id;
 id | region  | amount 
----+---------+--------
  1 | west    |    100
  2 | central |    200
  3 | west    |    300
  4 | west    |    400
(4 rows)

DELETE FROM upstream_inline_part_move WHERE id = 1;
SELECT * FROM ducklake.flush_inlined_data('upstream_inline_part_move'::regclass);
 schema_name | table_name | rows_flushed 
-------------+------------+--------------
(0 rows)

SELECT * FROM upstream_inline_part_move ORDER BY id;
 id | region  | amount 
----+---------+--------
  2 | central |    200
  3 | west    |    300
  4 | west    |    400
(3 rows)

CREATE TABLE upstream_inline_part_year (id integer, ts timestamp, amount double precision) USING ducklake;
CALL ducklake.set_partition('upstream_inline_part_year'::regclass, 'year(ts)');
INSERT INTO upstream_inline_part_year VALUES
 (1,'2020-06-15',10), (2,'2020-11-01',20), (3,'2021-03-20',30);
UPDATE upstream_inline_part_year SET ts = '2021-06-15' WHERE id = 1;
SELECT * FROM ducklake.flush_inlined_data('upstream_inline_part_year'::regclass);
 schema_name |        table_name         | rows_flushed 
-------------+---------------------------+--------------
 public      | upstream_inline_part_year |            4
(1 row)

SELECT * FROM upstream_inline_part_year ORDER BY id;
 id |            ts            | amount 
----+--------------------------+--------
  1 | Tue Jun 15 00:00:00 2021 |     10
  2 | Sun Nov 01 00:00:00 2020 |     20
  3 | Sat Mar 20 00:00:00 2021 |     30
(3 rows)

DROP TABLE upstream_inline_part_move, upstream_inline_part_year;
CALL ducklake.set_option('data_inlining_row_limit', 0);
