-- Upstream: test/sql/rowid/ducklake_row_id.test
CREATE TABLE upstream_row_id (i integer) USING ducklake;
SELECT ducklake.rowid() FROM upstream_row_id;
 rowid 
-------
(0 rows)

INSERT INTO upstream_row_id SELECT g FROM generate_series(0, 2) AS g;
INSERT INTO upstream_row_id SELECT g FROM generate_series(5, 6) AS g;
INSERT INTO upstream_row_id SELECT g FROM generate_series(10, 14) AS g;
SELECT ducklake.rowid(), i FROM upstream_row_id ORDER BY ducklake.rowid();
 rowid | i  
-------+----
     0 |  0
     1 |  1
     2 |  2
     3 |  5
     4 |  6
     5 | 10
     6 | 11
     7 | 12
     8 | 13
     9 | 14
(10 rows)

DELETE FROM upstream_row_id WHERE i % 2 = 1;
SELECT ducklake.rowid(), i FROM upstream_row_id ORDER BY ducklake.rowid();
 rowid | i  
-------+----
     0 |  0
     2 |  2
     4 |  6
     5 | 10
     7 | 12
     9 | 14
(6 rows)

UPDATE upstream_row_id SET i = i + 1000 WHERE i < 3 OR i > 10;
SELECT ducklake.rowid(), i FROM upstream_row_id ORDER BY ducklake.rowid();
 rowid |  i   
-------+------
     0 | 1000
     2 | 1002
     4 |    6
     5 |   10
     7 | 1012
     9 | 1014
(6 rows)

BEGIN;
UPDATE upstream_row_id SET i = i + 2000;
SELECT ducklake.rowid(), i FROM upstream_row_id ORDER BY ducklake.rowid();
 rowid |  i   
-------+------
     0 | 3000
     2 | 3002
     4 | 2006
     5 | 2010
     7 | 3012
     9 | 3014
(6 rows)

ROLLBACK;
SELECT ducklake.rowid(), i FROM upstream_row_id ORDER BY ducklake.rowid();
 rowid |  i   
-------+------
     0 | 1000
     2 | 1002
     4 |    6
     5 |   10
     7 | 1012
     9 | 1014
(6 rows)

DROP TABLE upstream_row_id;
