Parsed test spec with 3 sessions
check_session: NOTICE:  identifier "isolation/ducklake/transaction/transaction_conflicts_delete/check_session" will be truncated to "isolation/ducklake/transaction/transaction_conflicts_delete/che"

starting permutation: s1_begin s1_delete_partial s1_commit s2_begin s2_delete_partial s2_commit check_partial
step s1_begin: BEGIN;
step s1_delete_partial: DELETE FROM upstream_iso_delete_conflict WHERE i < 200;
step s1_commit: COMMIT;
step s2_begin: BEGIN;
step s2_delete_partial: DELETE FROM upstream_iso_delete_conflict WHERE i < 100;
step s2_commit: COMMIT;
step check_partial: SELECT count(*), min(i), max(i) FROM upstream_iso_delete_conflict;
count|min|max
-----+---+---
  800|200|999
(1 row)


starting permutation: s1_begin s1_delete_all s1_commit s2_begin s2_delete_all s2_commit check_empty
step s1_begin: BEGIN;
step s1_delete_all: DELETE FROM upstream_iso_delete_conflict;
step s1_commit: COMMIT;
step s2_begin: BEGIN;
step s2_delete_all: DELETE FROM upstream_iso_delete_conflict;
step s2_commit: COMMIT;
step check_empty: SELECT count(*) FROM upstream_iso_delete_conflict;
count
-----
    0
(1 row)


starting permutation: s2_begin s2_delete_all s2_commit s1_begin s1_drop s1_commit check_dropped
step s2_begin: BEGIN;
step s2_delete_all: DELETE FROM upstream_iso_delete_conflict;
step s2_commit: COMMIT;
step s1_begin: BEGIN;
step s1_drop: DROP TABLE upstream_iso_delete_conflict;
step s1_commit: COMMIT;
step check_dropped: SELECT to_regclass('upstream_iso_delete_conflict') IS NULL;
?column?
--------
t       
(1 row)

check_session: NOTICE:  table "upstream_iso_delete_conflict" does not exist, skipping

starting permutation: s2_begin s2_delete_all s2_commit s1_begin s1_alter s1_commit check_altered
step s2_begin: BEGIN;
step s2_delete_all: DELETE FROM upstream_iso_delete_conflict;
step s2_commit: COMMIT;
step s1_begin: BEGIN;
step s1_alter: ALTER TABLE upstream_iso_delete_conflict ADD COLUMN j integer;
step s1_commit: COMMIT;
step check_altered: 
  SELECT attname FROM pg_attribute
  WHERE attrelid = 'upstream_iso_delete_conflict'::regclass
    AND attnum > 0 AND NOT attisdropped ORDER BY attnum;
  SELECT count(*) FROM upstream_iso_delete_conflict;

attname
-------
i      
j      
(2 rows)

count
-----
    0
(1 row)

