-- Upstream: test/sql/delete/multi_deletes.test
-- Skip: scheduled and physically removed delete files are not observable through PostgreSQL metadata.
-- Repeated deletes must consolidate correctly within and across transactions.
CALL ducklake.set_option('data_inlining_row_limit', 0);
CREATE TABLE upstream_multi_deletes USING ducklake AS
SELECT i AS id FROM generate_series(0, 9999) AS g(i);
BEGIN;
DELETE FROM upstream_multi_deletes WHERE id % 8 = 0;
SELECT count(*), sum(id) FROM upstream_multi_deletes;
 count |   sum    
-------+----------
  8750 | 43750000
(1 row)

DELETE FROM upstream_multi_deletes WHERE id % 4 = 0;
SELECT count(*), sum(id) FROM upstream_multi_deletes;
 count |   sum    
-------+----------
  7500 | 37500000
(1 row)

COMMIT;
SELECT count(*), sum(id) FROM upstream_multi_deletes;
 count |   sum    
-------+----------
  7500 | 37500000
(1 row)

DELETE FROM upstream_multi_deletes WHERE id % 2 = 0;
SELECT count(*), sum(id) FROM upstream_multi_deletes;
 count |   sum    
-------+----------
  5000 | 25000000
(1 row)

SELECT count(*) AS active_delete_files
FROM ducklake.ducklake_delete_file f
JOIN ducklake.ducklake_table t USING (table_id)
WHERE t.table_name = 'upstream_multi_deletes'
  AND t.end_snapshot IS NULL AND f.end_snapshot IS NULL;
 active_delete_files 
---------------------
                   1
(1 row)

DROP TABLE upstream_multi_deletes;
